{
  "schema_version": "1.0.0",
  "release_id": "private-sector-study-1.52.0",
  "generated_at": "2026-09-07T00:29:21+00:00",
  "screen_date": "2026-09-03",
  "selection_basis": "Private commercial identity, documented development history or identifiable campus, and linked county panel. No economic outcome values used.",
  "scope": "Review of the existing dated evidence layer, verified lifecycle results, and additional named campus records. Not an exhaustive classification of every inventory entity.",
  "counts": {
    "projects": 36,
    "counties": 35,
    "states": 23,
    "campus_targets": 5,
    "history_evidence_available": 33,
    "groups": {
      "Colocation": 12,
      "Hyperscale": 21,
      "Private enterprise": 3
    },
    "projects_with_economic_evidence": 36,
    "economic_records": 938,
    "reported_actual_records": 833,
    "projection_records": 105,
    "modeled_synthesis_records": 160
  },
  "economic_evidence_status": "partial",
  "full_modeled_county_accounts": 3,
  "modeling_policy_version": "study-modeling-policy-1.3.0",
  "projects": [
    {
      "project_id": "prj_study_im3_building_00460089167",
      "name": "Meta Forest City",
      "inventory_entity_id": "fac_im3_building_00460089167",
      "inventory_entity_type": "facility",
      "county_fips": "37161",
      "county_name": "Rutherford County",
      "state_abbr": "NC",
      "operator_label": "Meta",
      "study_group": "Hyperscale",
      "membership_status": "research_candidate",
      "sector_status": "provisional_private_sector",
      "history_status": "evidence_available",
      "documented_timing": "2012-04-19 opening",
      "panel_years": 24,
      "detail_path": "projects/prj_study_im3_building_00460089167.json",
      "latitude": 35.314231256978196,
      "longitude": -81.82213877550394,
      "economic_record_count": 28,
      "reported_actual_count": 25,
      "projection_count": 3,
      "modeled_synthesis_count": 6,
      "research_completion_status": "account_research_complete",
      "model_completeness": {
        "status": "incomplete",
        "required_categories": [
          "investment",
          "construction",
          "suppliers",
          "operations",
          "fiscal",
          "public_costs",
          "resources",
          "community"
        ],
        "covered_categories": [
          "community",
          "construction",
          "fiscal",
          "investment",
          "operations",
          "public_costs",
          "resources"
        ],
        "modeled_categories": [
          "fiscal",
          "public_costs",
          "resources"
        ],
        "required_county_outcomes": [
          "study.modeled_county_employment_comparison_gap",
          "study.modeled_county_gdp_comparison_gap",
          "study.modeled_county_wage_comparison_gap"
        ],
        "covered_county_outcomes": [
          "study.modeled_county_employment_comparison_gap",
          "study.modeled_county_gdp_comparison_gap",
          "study.modeled_county_wage_comparison_gap"
        ],
        "missing_categories": [
          "suppliers"
        ],
        "missing_county_outcomes": [],
        "direct_evidence_gap_count": 8,
        "definition": "All eight contribution-account categories contain sourced or labeled modeled values, and GDP, employment, and wage county-comparison modules are populated. Comparison gaps are descriptive and do not establish causal facility effects."
      }
    },
    {
      "project_id": "prj_study_im3_building_00438078069",
      "name": "Meta Altoona",
      "inventory_entity_id": "fac_im3_building_00438078069",
      "inventory_entity_type": "facility",
      "county_fips": "19153",
      "county_name": "Polk County",
      "state_abbr": "IA",
      "operator_label": "Meta",
      "study_group": "Hyperscale",
      "membership_status": "research_candidate",
      "sector_status": "provisional_private_sector",
      "history_status": "evidence_available",
      "documented_timing": "2014-11-14 online",
      "panel_years": 24,
      "detail_path": "projects/prj_study_im3_building_00438078069.json",
      "latitude": 41.6642411277008,
      "longitude": -93.51472775765038,
      "economic_record_count": 1,
      "reported_actual_count": 1,
      "projection_count": 0,
      "modeled_synthesis_count": 0,
      "research_completion_status": "research_pending",
      "model_completeness": {
        "status": "incomplete",
        "required_categories": [
          "investment",
          "construction",
          "suppliers",
          "operations",
          "fiscal",
          "public_costs",
          "resources",
          "community"
        ],
        "covered_categories": [
          "construction"
        ],
        "modeled_categories": [],
        "required_county_outcomes": [
          "study.modeled_county_employment_comparison_gap",
          "study.modeled_county_gdp_comparison_gap",
          "study.modeled_county_wage_comparison_gap"
        ],
        "covered_county_outcomes": [],
        "missing_categories": [
          "community",
          "fiscal",
          "investment",
          "operations",
          "public_costs",
          "resources",
          "suppliers"
        ],
        "missing_county_outcomes": [
          "study.modeled_county_employment_comparison_gap",
          "study.modeled_county_gdp_comparison_gap",
          "study.modeled_county_wage_comparison_gap"
        ],
        "direct_evidence_gap_count": 8,
        "definition": "All eight contribution-account categories contain sourced or labeled modeled values, and GDP, employment, and wage county-comparison modules are populated. Comparison gaps are descriptive and do not establish causal facility effects."
      }
    },
    {
      "project_id": "prj_study_im3_building_00500820007",
      "name": "Meta Fort Worth",
      "inventory_entity_id": "fac_im3_building_00500820007",
      "inventory_entity_type": "facility",
      "county_fips": "48439",
      "county_name": "Tarrant County",
      "state_abbr": "TX",
      "operator_label": "Meta",
      "study_group": "Hyperscale",
      "membership_status": "research_candidate",
      "sector_status": "provisional_private_sector",
      "history_status": "evidence_available",
      "documented_timing": "Operating by 2017-12-11",
      "panel_years": 24,
      "detail_path": "projects/prj_study_im3_building_00500820007.json",
      "latitude": 32.98378403788744,
      "longitude": -97.25934313221771,
      "economic_record_count": 1,
      "reported_actual_count": 1,
      "projection_count": 0,
      "modeled_synthesis_count": 0,
      "research_completion_status": "research_pending",
      "model_completeness": {
        "status": "incomplete",
        "required_categories": [
          "investment",
          "construction",
          "suppliers",
          "operations",
          "fiscal",
          "public_costs",
          "resources",
          "community"
        ],
        "covered_categories": [
          "construction"
        ],
        "modeled_categories": [],
        "required_county_outcomes": [
          "study.modeled_county_employment_comparison_gap",
          "study.modeled_county_gdp_comparison_gap",
          "study.modeled_county_wage_comparison_gap"
        ],
        "covered_county_outcomes": [],
        "missing_categories": [
          "community",
          "fiscal",
          "investment",
          "operations",
          "public_costs",
          "resources",
          "suppliers"
        ],
        "missing_county_outcomes": [
          "study.modeled_county_employment_comparison_gap",
          "study.modeled_county_gdp_comparison_gap",
          "study.modeled_county_wage_comparison_gap"
        ],
        "direct_evidence_gap_count": 8,
        "definition": "All eight contribution-account categories contain sourced or labeled modeled values, and GDP, employment, and wage county-comparison modules are populated. Comparison gaps are descriptive and do not establish causal facility effects."
      }
    },
    {
      "project_id": "prj_study_im3_building_00626785488",
      "name": "Meta Los Lunas",
      "inventory_entity_id": "fac_im3_building_00626785488",
      "inventory_entity_type": "facility",
      "county_fips": "35061",
      "county_name": "Valencia County",
      "state_abbr": "NM",
      "operator_label": "Meta",
      "study_group": "Hyperscale",
      "membership_status": "research_candidate",
      "sector_status": "provisional_private_sector",
      "history_status": "evidence_available",
      "documented_timing": "2019-02-07 grand opening",
      "panel_years": 24,
      "detail_path": "projects/prj_study_im3_building_00626785488.json",
      "latitude": 34.830246608460115,
      "longitude": -106.78382909936067,
      "economic_record_count": 17,
      "reported_actual_count": 17,
      "projection_count": 0,
      "modeled_synthesis_count": 0,
      "research_completion_status": "account_research_complete",
      "model_completeness": {
        "status": "incomplete",
        "required_categories": [
          "investment",
          "construction",
          "suppliers",
          "operations",
          "fiscal",
          "public_costs",
          "resources",
          "community"
        ],
        "covered_categories": [
          "community",
          "construction",
          "fiscal",
          "operations",
          "public_costs",
          "resources"
        ],
        "modeled_categories": [],
        "required_county_outcomes": [
          "study.modeled_county_employment_comparison_gap",
          "study.modeled_county_gdp_comparison_gap",
          "study.modeled_county_wage_comparison_gap"
        ],
        "covered_county_outcomes": [],
        "missing_categories": [
          "investment",
          "suppliers"
        ],
        "missing_county_outcomes": [
          "study.modeled_county_employment_comparison_gap",